{
  "$schema": "../../../../schemas/acceptance-intent.schema.json",
  "schemaVersion": 1,
  "fixtureId": "playground/threading",
  "status": "proposed",
  "legacySources": ["threading.sweet.js"],
  "summary": "Thread a value through a comma-separated sequence of calls while preserving expression grouping.",
  "capabilities": [
    {
      "id": "PLAYGROUND-THREADING",
      "requirement": "Support the threading surface from the playground."
    },
    {
      "id": "PAT-EXPR",
      "requirement": "Capture one unparenthesized TypeScript expression at each step."
    },
    {
      "id": "PAT-REP-SEP",
      "requirement": "Match comma-separated call steps without flattening their argument captures."
    },
    {
      "id": "EXP-RECURSION",
      "requirement": "Permit a declarative rule to invoke the same syntax binding on a shorter input."
    },
    {
      "id": "HYG-CAPTURE-PRESERVE",
      "requirement": "Keep call-site bindings for the initial value, callees, arguments, and callback parameters."
    }
  ],
  "syntaxNotes": [
    "Commas separate steps and belong to the macro grammar.",
    "A step without explicit arguments inserts the threaded value as its sole argument.",
    "The thread form expands as an expression and may appear in an initializer."
  ],
  "artifacts": {
    "definition": "declarative.sts",
    "input": "acceptance.sts",
    "expansion": "expected.ts",
    "types": "types.ts",
    "runtime": "expected.runtime.json",
    "hygiene": {
      "input": "hygiene.sts",
      "expansion": "expected.hygiene.ts"
    },
    "malformed": [
      {
        "input": "malformed.sts",
        "diagnostics": "expected.malformed.diagnostics.json"
      }
    ]
  },
  "openDecisions": [
    {
      "id": "OPEN-REP-001",
      "question": "Retain Rust-style grouped repetition in the public notation?"
    }
  ]
}
